{
  "contract_version": "completion-policy/v1",
  "policy_id": "f0022-current-verification",
  "predicates": [
    {
      "id": "findings-empty",
      "json_path": "$.findings",
      "operator": "empty",
      "report_kind": "current_verification"
    },
    {
      "expected": "pass",
      "id": "verification-passed",
      "json_path": "$.status",
      "operator": "equals",
      "report_kind": "current_verification"
    }
  ],
  "required_evidence_set_status": "complete"
}
